{
  "mapId": "kandao-haizi",
  "schemaVersion": "1.1",
  "nodes": [
    {
      "id": "ch-part1",
      "type": "chapter",
      "label": "第1部分 贝姬医生的育儿准则",
      "summary": "本书第1部分题为“贝姬医生的育儿准则”，是作者一系列育儿准则集中展开的开端。",
      "content": "该部分以“第1部分　贝姬医生的育儿准则”开篇，随后依次展开各项准则，第一条即“准则1 善意养育”，其底层逻辑是父母和孩子的本心都是好的。",
      "source": {
        "chapter": "第1部分 贝姬医生的育儿准则",
        "file": "index_split_003.html",
        "excerpt": "第1部分　贝姬医生的育儿准则\n准则1 善意养育\n底层逻辑：父母和孩子的本心都是好的\n在我看来，你和孩子的本心都是好的。",
        "anchor": "index_split_003.html"
      },
      "tags": [
        "章节"
      ]
    },
    {
      "id": "ch-part2",
      "type": "chapter",
      "label": "第2部分 建立亲密感，改善行为",
      "summary": "本章主张在亲密感建立之前无法改变行为，应先积累情感资本、修复失衡的家庭系统，行为改善才会自然发生。",
      "content": "这一部分把家庭中的问题行为看作系统失衡的症状，而非需要逐个击破的具体毛病。作者提出一套“高效的亲密感培养法”，帮助父母把注意力集中在与孩子拉近距离上，而非纠正某个具体行为。无论失衡表现为无礼、撒谎、手足之争还是发脾气，这些方法都能引发积极的改变。",
      "source": {
        "chapter": "第2部分 建立亲密感，改善行为",
        "file": "index_split_013.html",
        "anchor": "index_split_013.html",
        "excerpt": "我们现在已经知道，行为从来都不是问题，它只是症状。这些事半功倍的方法能解决最根本的问题，因而也能让家庭气氛变得更加和睦。"
      },
      "tags": [
        "章节"
      ]
    },
    {
      "id": "ch-qianyan",
      "type": "chapter",
      "label": "前言",
      "summary": "作者交代共情取向育儿法的由来，主张以理解孩子内心取代单纯塑造行为。",
      "content": "前言从三位父母的典型困惑切入，指出行为是了解孩子内心困境的线索，也往往反映整个家庭的症结。作者批评源自行为主义、只重塑造行为而不惜牺牲亲子关系的做法，提出集合依恋理论、正念静观和内在家庭系统理论的育儿方法，把关注点从结果转向关系。",
      "source": {
        "chapter": "前言",
        "file": "index_split_002.html",
        "excerpt": "不少育儿法都会丢给父母一道选择题：要么牺牲亲子关系来改善孩子的行为，要么放松管教来保住亲子关系。但有了这本书中的方法，父母们就能“内”“外”兼修，既改善孩子的行为，让孩子更懂事，又增进亲子感情。",
        "anchor": "index_split_002.html"
      },
      "tags": [
        "章节"
      ]
    },
    {
      "id": "ch-shizhan1",
      "type": "chapter",
      "label": "实战1 我在育儿路上很受挫，有没有首先要解决的问题？",
      "summary": "育儿受挫时首先要处理的是家庭系统的失衡：先与孩子建立亲密感、积累情感资本，再谈行为改变。",
      "content": "面对吼叫、恐吓、顶嘴和哭闹的求助，作者指出真正的问题不是某个具体毛病，而是家庭系统失衡、所有人都失去了安全感。她把亲密感比作情感账户里的钱，父母需要多存少取。为此她介绍了一系列“高效的亲密感培养法”，如手机拜拜亲子时间、填充游戏、接种情绪疫苗、坐在孩子“情绪的长椅”上等。",
      "source": {
        "chapter": "实战1 我在育儿路上很受挫，有没有首先要解决的问题？",
        "file": "index_split_013.html",
        "anchor": "index_split_013.html",
        "excerpt": "专心陪伴孩子是积累情感资本的最佳方式。如果孩子不听话、没礼貌，或是两个孩子不和睦，你都可以试试手机拜拜亲子时间。其他类似情形也一样。"
      },
      "tags": [
        "章节"
      ]
    },
    {
      "id": "ch-shizhan10",
      "type": "chapter",
      "label": "实战10 孩子总是害羞和犹豫，怎么办？",
      "summary": "害羞和犹豫不是要解决的问题，父母要反思自身、接纳感受，帮孩子在接纳中建立真正的自信。",
      "content": "本章以躲在妈妈娜拉身后的贾伊为例，指出对害羞和犹豫在意的往往是父母，父母介入常常只是为了缓解自己的不适。作者认为自信是知道自己的感受并接纳拥有当下感受的自己，父母可以借助“等你准备好了再说”、提前做物质与心理准备、不给孩子贴标签等方式支持孩子，并反思自己内心的感受。",
      "source": {
        "chapter": "实战10 孩子总是害羞和犹豫，怎么办？",
        "file": "index_split_022.html",
        "excerpt": "在我看来，自信就是知道自己的感受，并且接受那个拥有当下感受的自己。不确定自己是否想跟别的孩子一起玩并在一旁观察也可能是自信的表现。",
        "anchor": "index_split_022.html"
      },
      "tags": [
        "章节"
      ]
    },
    {
      "id": "ch-shizhan11",
      "type": "chapter",
      "label": "实战11 为什么我的孩子总是无法忍受挫折？",
      "summary": "挫折是学习过程的必经部分，父母自身要能耐受孩子的挫折，并培养孩子停留“学习”区间与成长心态。",
      "content": "本章以怎么都拼不好拼图的布雷登为例，提出学习领域一个深刻的悖论：越是承认自己不懂、是错的、不知道怎么办，就越能快速成长进步。作者强调提升孩子挫折耐受能力的前提是提升父母自身对孩子所受挫折的耐受力，并介绍深呼吸、口头禅、成长心态的家庭价值观、注重应对挫折感而非获取成功等做法。",
      "source": {
        "chapter": "实战11 为什么我的孩子总是无法忍受挫折？",
        "file": "index_split_023.html",
        "excerpt": "我经常提醒自己，身为父母的职责不是帮助孩子离开“学习”的部分而进入“懂”的状态……而是帮助孩子学会停留在“学习”的部分，忍受尚未达到“懂”的状态！",
        "anchor": "index_split_023.html"
      },
      "tags": [
        "章节"
      ]
    },
    {
      "id": "ch-shizhan12",
      "type": "chapter",
      "label": "实战12 孩子吃饭难，怎么办？",
      "summary": "吃饭难背后是父母的养育焦虑与孩子的身体主权之争，应按萨特的责任划分各司其职、减少焦虑。",
      "content": "本章以只爱吃零食的吉娅为例，说明孩子吃了什么、吃了多少被父母当作是否合格的标尺，而吃饭难也涉及更深层的身体主权问题，即谁拥有对吃饭这一行为的控制权。作者援引营养师埃琳·萨特的责任划分理论，主张父母决定吃什么、在哪儿吃、何时吃，孩子决定吃不吃、吃多少，并学会容忍孩子的抱怨和不满。",
      "source": {
        "chapter": "实战12 孩子吃饭难，怎么办？",
        "file": "index_split_024.html",
        "excerpt": "从一定程度上说，孩子吃了什么、吃了多少就是衡量我们这些父母是否合格的标尺。如果孩子不吃我们做给他的饭，那样子就像在说：“我不接受你为我做的事，我不接受你的饭，也不接受你。你就是个坏父母！”",
        "anchor": "index_split_024.html"
      },
      "tags": [
        "章节"
      ]
    },
    {
      "id": "ch-shizhan13",
      "type": "chapter",
      "label": "实战13 为什么允许孩子遵从内心的感受很重要？",
      "summary": "身体主权来自早年经历，父母应信任孩子感受、建立遵从内心的脑回路，而非让孩子去取悦他人。",
      "content": "本章以拒绝外公拥抱的琪琪为例，论证孩子能否对他人说“不”，取决于父母在他们遇到困难的时候做了什么，而非父母说了什么。作者主张父母相信孩子的感受、常说“你的身体里只有你”，并停止使用“太夸张了”“你太敏感”这类涉及心理虐待的表达，让孩子形成遵从内心感受、自我信任的脑回路。",
      "source": {
        "chapter": "实战13 为什么允许孩子遵从内心的感受很重要？",
        "file": "index_split_025.html",
        "excerpt": "我们看待和行使身体主权（所有人都有权完全控制自己的身体）的方式会不可避免地影响我们的孩子。我们认为自己有权掌控我们的身体，这种意识并非来自课堂或书本，而是来自我们的早年经历，即我们那时候是否觉得自己有权这么做。",
        "anchor": "index_split_025.html"
      },
      "tags": [
        "章节"
      ]
    },
    {
      "id": "ch-shizhan14",
      "type": "chapter",
      "label": "实战14 我们应该怎样对待孩子的哭泣？",
      "summary": "以优素福落选棒球队哭泣为例，说明眼泪是身体传递感受信息的方式，父母应打破对哭泣的羞耻感，带着好奇与共情走近孩子。",
      "content": "本章由阿卜杜拉的困惑引出：面对孩子的眼泪，父母常不知道该说什么、是否该用安慰摆脱它。作者指出哭是依恋关系中的信号，对哭泣的羞耻感往往代际相传，父母可以同时坚定维护行为规则、又带着共情走近孩子。书中给出与孩子聊眼泪、把眼泪与重要事情联系起来、苏格拉底式提问等工具。",
      "source": {
        "chapter": "实战14 我们应该怎样对待孩子的哭泣？",
        "file": "index_split_026.html",
        "excerpt": "请记住，我们对孩子的什么行为反应强烈，就代表我们幼时压抑了自己的这一行为。对哭泣的羞耻感往往会代代相传",
        "anchor": "index_split_026.html"
      },
      "tags": [
        "章节"
      ]
    },
    {
      "id": "ch-shizhan15",
      "type": "chapter",
      "label": "实战15 如何帮助孩子建立自信？",
      "summary": "以查理玩捉人游戏落败哭泣为例，主张自信不是感觉好而是接纳自己的所有感受，帮孩子建立自信要靠接纳感受与夸奖过程。",
      "content": "作者重新定义自信：自信是不论自己有什么感受都能感到自在，是信任自己。父母否认或劝说孩子摆脱痛苦，其实是在伤害自信。她给出接纳孩子感受、“你是怎么想到……的？”、内心世界重于外在表现等做法，并强调内部肯定优于外部赞美。",
      "source": {
        "chapter": "实战15 如何帮助孩子建立自信？",
        "file": "index_split_027.html",
        "excerpt": "我们常常教导孩子，自信就是自我感觉良好、自豪和对自己感到满意，其实不然。我知道，我这么说可能会显得有些冒失，但我坚信，我们现在该用全新的方式来看待自信了。",
        "anchor": "index_split_027.html"
      },
      "tags": [
        "章节"
      ]
    },
    {
      "id": "ch-shizhan16",
      "type": "chapter",
      "label": "实战16 是否要纠正孩子的完美主义？",
      "summary": "以芙蕾娅写作崩溃为例，说明完美主义源自情绪调节问题，父母应帮孩子看到而非摆脱完美主义，学会拥抱灰色地带。",
      "content": "有完美主义倾向的孩子比较刻板，无法区分行为与个性特征，会把行为直接等同于“我聪明”或“我笨”。他们感觉安全的舒适区很小，事情不达预期就情绪低落。作者主张帮孩子扩大舒适区、把做什么样的事与是什么样的人分开，并提供示范犯错、说出感受、假扮游戏、认识“完美小孩”等工具。",
      "source": {
        "chapter": "实战16 是否要纠正孩子的完美主义？",
        "file": "index_split_028.html",
        "excerpt": "有的孩子做事情只接受完美无缺，不接受“差不多”，只要不是百分百如意，他们就会情绪低落，这是怎么回事呢？",
        "anchor": "index_split_028.html"
      },
      "tags": [
        "章节"
      ]
    },
    {
      "id": "ch-shizhan17",
      "type": "chapter",
      "label": "实战17 怎样缓解孩子的分离焦虑？",
      "summary": "以韦斯利入园哭闹为例，说明分离焦虑源于依恋，父母需帮助孩子内化安全感，并借助过渡性客体与分离仪式缓解焦虑。",
      "content": "孩子在与父母分离时必须在新环境、新的养育者那里重新找到安全感，这需要把父母陪伴时常有的感觉内化。作者引用温尼科特的观点，推荐使用过渡性客体，并强调父母在分离时刻的自信会极大影响孩子的表现。工具包括关注自身焦虑、提前跟孩子聊聊、分离仪式和演练、通过讲述回顾等。",
      "source": {
        "chapter": "实战17 怎样缓解孩子的分离焦虑？",
        "file": "index_split_029.html",
        "excerpt": "分离是艰难的。孩子在幼儿园门口哭闹，抱住大人不放，或者因为要上幼儿园而迟迟不肯出门，这都没有任何错。",
        "anchor": "index_split_029.html"
      },
      "tags": [
        "章节"
      ]
    },
    {
      "id": "ch-shizhan18",
      "type": "chapter",
      "label": "实战18 我们可以如何改善孩子的睡眠问题？",
      "summary": "以科拉不肯睡觉为例，指出睡眠问题说穿了是分离焦虑，改善睡眠要分两步：先建立安全感，再促进睡眠。",
      "content": "夜里孩子要独自待上几个甚至十几个小时并保持足够安全才能入睡，因此睡眠困难的根源是分离焦虑。作者提出两步走方案，反对锁门、忽视恐惧等行为主义做法，给出“我们夜里都在哪里？”、演练睡前仪式、把陪伴融入孩子心中、巧用口头禅、安全距离法、安抚按钮等工具。",
      "source": {
        "chapter": "实战18 我们可以如何改善孩子的睡眠问题？",
        "file": "index_split_030.html",
        "excerpt": "没有什么比白天忙碌一整天，晚上孩子不睡觉，或者孩子半夜醒来让你没法休息更难受的了。",
        "anchor": "index_split_030.html"
      },
      "tags": [
        "章节"
      ]
    },
    {
      "id": "ch-shizhan19",
      "type": "chapter",
      "label": "实战19 家里有高敏感的孩子，怎么办？",
      "summary": "以毛拉情绪爆发为例，说明高敏感的孩子没有问题，其崩溃源于羞耻感与受威胁状态，父母要镇场子、陪伴并减少破坏。",
      "content": "高敏感的孩子感受更深、脾气更快更久，其脆弱与羞耻感紧密相连，因而无法接受父母直接提供的支持。作者主张父母用好奇代替指责、控制局面、把孩子看作“遇到了困难的好孩子”，以陪伴等待情绪风暴平息，并推荐大拇指游戏。",
      "source": {
        "chapter": "实战19 家里有高敏感的孩子，怎么办？",
        "file": "index_split_031.html",
        "excerpt": "有些孩子对事物的感受更深，脾气也比其他孩子来得更快，他们的强烈情绪也持续更久。如果这些描述让你不由得想起自己的孩子，那么我想说的是你并没有想多。",
        "anchor": "index_split_031.html"
      },
      "tags": [
        "章节"
      ]
    },
    {
      "id": "ch-shizhan2",
      "type": "chapter",
      "label": "实战2 孩子不听话（或者说，不合作）怎么办？",
      "summary": "所谓“孩子不听话”的真相是孩子不合作，而合作的前提是亲密感，因此要先拉近关系再提要求。",
      "content": "孩子听话与否只是特定时刻下亲子关系亲密程度的标尺，因此不听话应归结到关系而非孩子身上。父母要求孩子停止喜欢的事去做不喜欢的事，孩子不合作是合情合理的，问题在于提出要求的方式。作者给出先拉近关系再提要求、给孩子选择权、提升游戏力、闭眼技巧、角色互换游戏等做法。",
      "source": {
        "chapter": "实战2 孩子不听话（或者说，不合作）怎么办？",
        "file": "index_split_014.html",
        "anchor": "index_split_014.html",
        "excerpt": "对于索尼娅遭遇的这类情形，我们实际上说的是“合作”。我们嘴上说的是“我家孩子不听话”，但我们的意思其实是：“当我想让孩子做他不想做的事情的时候，孩子不合作。”"
      },
      "tags": [
        "章节"
      ]
    },
    {
      "id": "ch-shizhan3",
      "type": "chapter",
      "label": "实战3 如何应对孩子情绪化地发脾气？",
      "summary": "发脾气是健康的、失调的生理状态而非故意捣乱，目标是提升孩子的情绪调节能力，而非让他停止发脾气。",
      "content": "发脾气意味着孩子无法应对特定情形下的情感需求，往往始于愿望受挫。透过发脾气的表象，看到的是一个痛苦持续蓄积的孩子，其中包括沮丧、失望、嫉妒、悲伤或愤怒。应对策略旨在保持冷静、保证安全并提升孩子的情绪调节能力，而不是让孩子停止大喊大叫或哭泣。",
      "source": {
        "chapter": "实战3 如何应对孩子情绪化地发脾气？",
        "file": "index_split_015.html",
        "anchor": "index_split_015.html",
        "excerpt": "发脾气是正常的。事实上，发脾气不仅很正常，而且是健康的。当然，这并不是说发脾气很好玩，或者不会造成什么妨碍，我说的不是这些。"
      },
      "tags": [
        "章节"
      ]
    },
    {
      "id": "ch-shizhan4",
      "type": "chapter",
      "label": "实战4 如何纠正伴随攻击行为的发脾气（打人、咬人、扔东西）？",
      "summary": "伴随攻击行为的发脾气中孩子认为自己身处危险，父母要坚决介入、约束行为，以保护孩子的安全。",
      "content": "打人、踢人、掐人、吐口水、咬人表明孩子的额叶已不再发挥作用，被情绪淹没并进入对抗“威胁”的状态。此时父母要展现权威的一面，容忍孩子的不满，通过约束行为来体现对孩子的爱。做法包括“我不会允许你……”、区分冲动和行动、控制火势以及重新翻译孩子的语言。",
      "source": {
        "chapter": "实战4 如何纠正伴随攻击行为的发脾气（打人、咬人、扔东西）？",
        "file": "index_split_016.html",
        "anchor": "index_split_016.html",